<?xml version="1.0" encoding="UTF-8"?>
<?xml-stylesheet type="text/xsl"?>
<plantas xmlns:xsi="http://www.w3.org/2001/XMLSchema-instance" xsi:noNamespaceSchemaLocation="data.xsd">
    <planta>
        <titulo>Guisante 1</titulo>
        <texto>Planta básica que dispara guisantes a los zombies. Ideal para empezar tu defensa.</texto>
        <imagen>guisante1.png</imagen>
    </planta>
    <planta>
        <titulo>Guisante 2</titulo>
        <texto>Versión mejorada del guisante. Dispara con más frecuencia que el básico.</texto>
        <imagen>guisante2.png</imagen>
    </planta>
    <planta>
        <titulo>Guisante 3</titulo>
        <texto>Dispara más rápido que sus predecesores. Excelente para oleadas rápidas.</texto>
        <imagen>guisante3.png</imagen>
    </planta>
    <planta>
        <titulo>Guisante 4</titulo>
        <texto>Planta de ataque especializada. Sus guisantes son más poderosos.</texto>
        <imagen>guisante4.png</imagen>
    </planta>
    <planta>
        <titulo>Guisante 5</titulo>
        <texto>Variante especial que puede congelar a los zombies temporalmente.</texto>
        <imagen>guisante5.png</imagen>
    </planta>
    <planta>
        <titulo>Guisante 6</titulo>
        <texto>Defiende el jardín con disparos de triple guisante. Cobertura perfecta.</texto>
        <imagen>guisante6.png</imagen>
    </planta>
    <planta>
        <titulo>Guisante 7</titulo>
        <texto>Planta avanzada con munición explosiva. Daño en área.</texto>
        <imagen>guisante7.png</imagen>
    </planta>
    <planta>
        <titulo>Guisante 8</titulo>
        <texto>Planta fuerte con resistencia mejorada. Aguanta varios mordiscos.</texto>
        <imagen>guisante8.png</imagen>
    </planta>
    <planta>
        <titulo>Guisante 9</titulo>
        <texto>Última planta de la colección. El defensor definitivo del jardín.</texto>
        <imagen>guisante9.png</imagen>
    </planta>
</plantas>